{
  "schema_version": "0.1.0",
  "status": "normative_skeleton",
  "notes": "PT-ARCH-011 / F8 / C2 skeleton. First-class Capability directory for wire ProviderCapability ids. CapabilityTag remains Experimental via capability-tag-mapping. Not an inverted index (CR-CAP-001).",
  "entries": [
    {
      "id": "text",
      "kind": "provider_capability",
      "schema_ref": "schemas/v2/capabilities.json#/$defs/capability_name",
      "version": "1.0.0",
      "compatibility": {
        "protocol_trees": [
          "v1",
          "v2",
          "v2-alpha"
        ],
        "notes": "Declared on provider manifests; LTS production default remains v1 wire (VERSION_AUTHORITY)"
      },
      "metadata": {
        "description": "Core text generation / chat completion",
        "runtime_module_hint": "Core (always loaded)"
      },
      "provider_mapping": {
        "declaration_path": "capabilities.required|optional",
        "notes": "Manifest Capability Spec (PT-ARCH-004 L-Cap); not a CapabilityTag and not a host inverted index"
      }
    },
    {
      "id": "streaming",
      "kind": "provider_capability",
      "schema_ref": "schemas/v2/capabilities.json#/$defs/capability_name",
      "version": "1.0.0",
      "compatibility": {
        "protocol_trees": [
          "v1",
          "v2",
          "v2-alpha"
        ],
        "notes": "Declared on provider manifests; LTS production default remains v1 wire (VERSION_AUTHORITY)"
      },
      "metadata": {
        "description": "Streaming response delivery",
        "runtime_module_hint": "streaming.*"
      },
      "provider_mapping": {
        "declaration_path": "capabilities.required|optional",
        "notes": "Manifest Capability Spec (PT-ARCH-004 L-Cap); not a CapabilityTag and not a host inverted index"
      }
    },
    {
      "id": "vision",
      "kind": "provider_capability",
      "schema_ref": "schemas/v2/capabilities.json#/$defs/capability_name",
      "version": "1.0.0",
      "compatibility": {
        "protocol_trees": [
          "v1",
          "v2",
          "v2-alpha"
        ],
        "notes": "Declared on provider manifests; LTS production default remains v1 wire (VERSION_AUTHORITY)"
      },
      "metadata": {
        "description": "Image / visual input understanding",
        "runtime_module_hint": "multimodal.vision"
      },
      "provider_mapping": {
        "declaration_path": "capabilities.required|optional",
        "notes": "Manifest Capability Spec (PT-ARCH-004 L-Cap); not a CapabilityTag and not a host inverted index"
      }
    },
    {
      "id": "audio",
      "kind": "provider_capability",
      "schema_ref": "schemas/v2/capabilities.json#/$defs/capability_name",
      "version": "1.0.0",
      "compatibility": {
        "protocol_trees": [
          "v1",
          "v2",
          "v2-alpha"
        ],
        "notes": "Declared on provider manifests; LTS production default remains v1 wire (VERSION_AUTHORITY)"
      },
      "metadata": {
        "description": "Audio input understanding",
        "runtime_module_hint": "multimodal.audio"
      },
      "provider_mapping": {
        "declaration_path": "capabilities.required|optional",
        "notes": "Manifest Capability Spec (PT-ARCH-004 L-Cap); not a CapabilityTag and not a host inverted index"
      }
    },
    {
      "id": "video",
      "kind": "provider_capability",
      "schema_ref": "schemas/v2/capabilities.json#/$defs/capability_name",
      "version": "1.0.0",
      "compatibility": {
        "protocol_trees": [
          "v1",
          "v2",
          "v2-alpha"
        ],
        "notes": "Declared on provider manifests; LTS production default remains v1 wire (VERSION_AUTHORITY)"
      },
      "metadata": {
        "description": "Video input understanding",
        "runtime_module_hint": "multimodal.video"
      },
      "provider_mapping": {
        "declaration_path": "capabilities.required|optional",
        "notes": "Manifest Capability Spec (PT-ARCH-004 L-Cap); not a CapabilityTag and not a host inverted index"
      }
    },
    {
      "id": "tools",
      "kind": "provider_capability",
      "schema_ref": "schemas/v2/capabilities.json#/$defs/capability_name",
      "version": "1.0.0",
      "compatibility": {
        "protocol_trees": [
          "v1",
          "v2",
          "v2-alpha"
        ],
        "notes": "Declared on provider manifests; LTS production default remains v1 wire (VERSION_AUTHORITY)"
      },
      "metadata": {
        "description": "Tool / function calling",
        "runtime_module_hint": "tools.*"
      },
      "provider_mapping": {
        "declaration_path": "capabilities.required|optional",
        "notes": "Manifest Capability Spec (PT-ARCH-004 L-Cap); not a CapabilityTag and not a host inverted index"
      }
    },
    {
      "id": "parallel_tools",
      "kind": "provider_capability",
      "schema_ref": "schemas/v2/capabilities.json#/$defs/capability_name",
      "version": "1.0.0",
      "compatibility": {
        "protocol_trees": [
          "v1",
          "v2",
          "v2-alpha"
        ],
        "notes": "Declared on provider manifests; LTS production default remains v1 wire (VERSION_AUTHORITY)"
      },
      "metadata": {
        "description": "Parallel tool invocations in one turn",
        "runtime_module_hint": "tools.parallel"
      },
      "provider_mapping": {
        "declaration_path": "capabilities.required|optional",
        "notes": "Manifest Capability Spec (PT-ARCH-004 L-Cap); not a CapabilityTag and not a host inverted index"
      }
    },
    {
      "id": "agentic",
      "kind": "provider_capability",
      "schema_ref": "schemas/v2/capabilities.json#/$defs/capability_name",
      "version": "1.0.0",
      "compatibility": {
        "protocol_trees": [
          "v1",
          "v2",
          "v2-alpha"
        ],
        "notes": "Declared on provider manifests; LTS production default remains v1 wire (VERSION_AUTHORITY)"
      },
      "metadata": {
        "description": "Agentic multi-step tool loops",
        "runtime_module_hint": "agentic.*"
      },
      "provider_mapping": {
        "declaration_path": "capabilities.required|optional",
        "notes": "Manifest Capability Spec (PT-ARCH-004 L-Cap); not a CapabilityTag and not a host inverted index"
      }
    },
    {
      "id": "reasoning",
      "kind": "provider_capability",
      "schema_ref": "schemas/v2/capabilities.json#/$defs/capability_name",
      "version": "1.0.0",
      "compatibility": {
        "protocol_trees": [
          "v1",
          "v2",
          "v2-alpha"
        ],
        "notes": "Declared on provider manifests; LTS production default remains v1 wire (VERSION_AUTHORITY)"
      },
      "metadata": {
        "description": "Extended reasoning / thinking blocks",
        "runtime_module_hint": "reasoning.*"
      },
      "provider_mapping": {
        "declaration_path": "capabilities.required|optional",
        "notes": "Manifest Capability Spec (PT-ARCH-004 L-Cap); not a CapabilityTag and not a host inverted index"
      }
    },
    {
      "id": "embeddings",
      "kind": "provider_capability",
      "schema_ref": "schemas/v2/capabilities.json#/$defs/capability_name",
      "version": "1.0.0",
      "compatibility": {
        "protocol_trees": [
          "v1",
          "v2",
          "v2-alpha"
        ],
        "notes": "Declared on provider manifests; LTS production default remains v1 wire (VERSION_AUTHORITY)"
      },
      "metadata": {
        "description": "Embedding vectors",
        "runtime_module_hint": "embeddings.*"
      },
      "provider_mapping": {
        "declaration_path": "capabilities.required|optional",
        "notes": "Manifest Capability Spec (PT-ARCH-004 L-Cap); not a CapabilityTag and not a host inverted index"
      }
    },
    {
      "id": "structured_output",
      "kind": "provider_capability",
      "schema_ref": "schemas/v2/capabilities.json#/$defs/capability_name",
      "version": "1.0.0",
      "compatibility": {
        "protocol_trees": [
          "v1",
          "v2",
          "v2-alpha"
        ],
        "notes": "Declared on provider manifests; LTS production default remains v1 wire (VERSION_AUTHORITY)"
      },
      "metadata": {
        "description": "Schema-constrained / JSON-mode output",
        "runtime_module_hint": "structured.*"
      },
      "provider_mapping": {
        "declaration_path": "capabilities.required|optional",
        "notes": "Manifest Capability Spec (PT-ARCH-004 L-Cap); not a CapabilityTag and not a host inverted index"
      }
    },
    {
      "id": "batch",
      "kind": "provider_capability",
      "schema_ref": "schemas/v2/capabilities.json#/$defs/capability_name",
      "version": "1.0.0",
      "compatibility": {
        "protocol_trees": [
          "v1",
          "v2",
          "v2-alpha"
        ],
        "notes": "Declared on provider manifests; LTS production default remains v1 wire (VERSION_AUTHORITY)"
      },
      "metadata": {
        "description": "Batch inference APIs",
        "runtime_module_hint": "batch.*"
      },
      "provider_mapping": {
        "declaration_path": "capabilities.required|optional",
        "notes": "Manifest Capability Spec (PT-ARCH-004 L-Cap); not a CapabilityTag and not a host inverted index"
      }
    },
    {
      "id": "image_generation",
      "kind": "provider_capability",
      "schema_ref": "schemas/v2/capabilities.json#/$defs/capability_name",
      "version": "1.0.0",
      "compatibility": {
        "protocol_trees": [
          "v1",
          "v2",
          "v2-alpha"
        ],
        "notes": "Declared on provider manifests; LTS production default remains v1 wire (VERSION_AUTHORITY)"
      },
      "metadata": {
        "description": "Image generation",
        "runtime_module_hint": "generation.image"
      },
      "provider_mapping": {
        "declaration_path": "capabilities.required|optional",